{
  "$schema": "../tool.schema.json",
  "binary": "terragrunt",
  "categories": ["formatter"],
  "commands": {
    "hclfmt": ["hclfmt", "--terragrunt-hclfmt-file", "$PATH"]
  },
  "description": "Recursively find hcl files and rewrite them into a canonical format",
  "homepage": "https://terragrunt.gruntwork.io/docs/reference/cli-options/#hclfmt",
  "languages": ["hcl"],
  "name": null,
  "npm": null,
  "php": null,
  "tests": []
}
