{
  "$schema": "../tool.schema.json",
  "binary": "ocamlformat",
  "categories": ["formatter"],
  "commands": {
    "": [
      "--ignore-invalid-option",
      "--inplace",
      "--enable-outside-detected-project",
      "$PATH"
    ]
  },
  "description": "Auto-formatter for OCaml code",
  "homepage": "https://github.com/ocaml-ppx/ocamlformat",
  "languages": ["ocaml"],
  "name": null,
  "npm": null,
  "php": null,
  "tests": [
    {
      "command": "",
      "language": "ocaml",
      "test_input": "\nlet add a b  =  a +  b\n            ",
      "test_output": "let add a b = a + b\n"
    }
  ]
}
