{
  "$schema": "../tool.schema.json",
  "binary": "crlfmt",
  "categories": ["formatter"],
  "commands": {
    "": ["-w", "$PATH"]
  },
  "description": "Formatter for CockroachDB's additions to the Go style guide",
  "homepage": "https://github.com/cockroachdb/crlfmt",
  "languages": ["go"],
  "name": null,
  "npm": null,
  "php": null,
  "tests": []
}
