{
  "$schema": "../tool.schema.json",
  "binary": "gci",
  "categories": ["formatter"],
  "commands": {
    "": ["write", "--skip-generated", "--skip-vender", "$PATH"]
  },
  "description": "GCI, a tool that control golang package import order and make it always deterministic",
  "homepage": "https://github.com/daixiang0/gci",
  "languages": ["go"],
  "name": null,
  "npm": null,
  "php": null,
  "tests": []
}
