{
  "$schema": "../tool.schema.json",
  "binary": "hindent",
  "categories": ["formatter"],
  "commands": {
    "": ["$PATH"]
  },
  "description": "",
  "homepage": "",
  "languages": ["haskell"],
  "name": null,
  "npm": null,
  "php": null,
  "tests": [
    {
      "command": "",
      "language": "haskell",
      "test_input": "\naddNumbers::Int->Int->Int\naddNumbers a b = do\n        a + b\n        ",
      "test_output": "addNumbers :: Int -> Int -> Int\naddNumbers a b = do\n  a + b\n"
    }
  ]
}
