{
  "$schema": "../tool.schema.json",
  "binary": "dockfmt",
  "categories": ["formatter"],
  "commands": {
    "": ["fmt", "-w", "$PATH"]
  },
  "description": "Dockerfile format and parser. Like `gofmt` but for Dockerfiles",
  "homepage": "https://github.com/jessfraz/dockfmt",
  "languages": ["docker"],
  "name": null,
  "npm": null,
  "php": null,
  "tests": []
}
