{
  "$schema": "../tool.schema.json",
  "binary": "pyment",
  "categories": ["formatter"],
  "commands": {
    "": ["-w", "$PATH"]
  },
  "description": "Format and convert Python docstrings and generates patches",
  "homepage": "https://github.com/dadadel/pyment",
  "languages": ["python"],
  "name": null,
  "npm": null,
  "php": null,
  "tests": []
}
