{
  "$schema": "../tool.schema.json",
  "binary": "jsonnetfmt",
  "categories": ["formatter"],
  "commands": {
    "": ["-i", "$PATH"]
  },
  "description": "Formatter for automatically fixing jsonnet stylistic problems",
  "homepage": "https://jsonnet.org/learning/tools.html",
  "languages": ["jsonnet"],
  "name": null,
  "npm": null,
  "php": null,
  "tests": []
}
