{
  "$schema": "../tool.schema.json",
  "binary": "bsfmt",
  "categories": ["formatter"],
  "commands": {
    "": ["$PATH", "--write"]
  },
  "description": "A code formatter for BrightScript and BrighterScript",
  "homepage": "https://github.com/rokucommunity/brighterscript-formatter",
  "languages": ["brightscript", "brighterscript"],
  "name": null,
  "npm": "brighterscript-formatter",
  "php": null,
  "tests": []
}
