{
  "$schema": "../tool.schema.json",
  "binary": "fantomas",
  "categories": ["formatter"],
  "commands": {
    "": ["$PATH"]
  },
  "description": "FSharp source code formatter",
  "homepage": "https://github.com/fsprojects/fantomas",
  "languages": ["fsharp"],
  "name": null,
  "npm": null,
  "php": null,
  "tests": [
    {
      "command": "",
      "language": "fsharp",
      "test_input": "\nlet add a b  =  a +  b\n            ",
      "test_output": "let add a b = a + b\n"
    }
  ]
}
