{
  "$schema": "../tool.schema.json",
  "binary": "mypy",
  "categories": ["linter"],
  "commands": {
    "": ["$PATH"]
  },
  "description": "Optional static typing for Python",
  "homepage": "https://github.com/python/mypy",
  "languages": ["python"],
  "name": null,
  "npm": null,
  "php": null,
  "tests": []
}
